date_post,date_extraction,influencer,post_type,post_url,platform,comment,comment_likecount,replies,BU;;;;;;;;;
"2021-9-12,2021-12-01,espdaniella,VIDEO,https://www.tiktok.com/@espdaniella/video/7007109992926989574?lang=en,TikTok,""Oh so it’s an ad lol, how do I know if it’s even good then 💀"",27,,CS";;;;;;;;;
2021-9-12,2021-12-01,espdaniella,VIDEO,https://www.tiktok.com/@espdaniella/video/7007109992926989574?lang=en,TikTok,it’s not good chegg apparently rats out on students,14,,CS;;;;;;;;;
"2021-9-11,2021-12-01,themccartys,VIDEO,https://www.tiktok.com/@themccartys/video/7006777814015855878?lang=en,TikTok,""Wow is she single? She is pretty cute, especially with that haircut. 🥰😂"",10,,CS";;;;;;;;;
2021-9-11,2021-12-01,themccartys,VIDEO,https://www.tiktok.com/@themccartys/video/7006777814015855878?lang=en,TikTok,I hope Audri looks different at that age,71,,CS;;;;;;;;;
2021-9-11,2021-12-01,themccartys,VIDEO,https://www.tiktok.com/@themccartys/video/7006777814015855878?lang=en,TikTok,I absolutely love it!,26,,CS;;;;;;;;;
2021-9-11,2021-12-01,themccartys,VIDEO,https://www.tiktok.com/@themccartys/video/7006777814015855878?lang=en,TikTok,so this is what Audri will look like as a Freshman in College? 🤣🤣🤣🤣🤣,30,,CS;;;;;;;;;
2021-9-11,2021-12-01,themccartys,VIDEO,https://www.tiktok.com/@themccartys/video/7006777814015855878?lang=en,TikTok,Oh my I hope not 😂,20,,CS;;;;;;;;;
2021-10-15,2021-12-01,rrogersworld,VIDEO,https://www.tiktok.com/@rrogersworld/video/7019375006417308934?lang=en,TikTok,Math is hard 😳😳😳,13,,CS;;;;;;;;;
2021-10-15,2021-12-01,rrogersworld,VIDEO,https://www.tiktok.com/@rrogersworld/video/7019375006417308934?lang=en,TikTok,This was me. I cannot MATH,24,,CS;;;;;;;;;
2021-10-15,2021-12-01,rrogersworld,VIDEO,https://www.tiktok.com/@rrogersworld/video/7019375006417308934?lang=en,TikTok,I can history all day long but I cannot math or science… and sometimes I can’t English 😂 what about you?!?,41,,CS;;;;;;;;;
2021-10-15,2021-12-01,rrogersworld,VIDEO,https://www.tiktok.com/@rrogersworld/video/7019375006417308934?lang=en,TikTok,This is so neat! @Chegg for the win!,8,,CS;;;;;;;;;
2021-10-8,2021-12-01,cloutom,VIDEO,https://www.tiktok.com/@cloutom/video/7016955575757966593?is_from_webapp=v1,TikTok,That is a 7th grade problem😑 Won't work on my maths.,25,,CS;;;;;;;;;
2021-10-8,2021-12-01,cloutom,VIDEO,https://www.tiktok.com/@cloutom/video/7016955575757966593?is_from_webapp=v1,TikTok,Why you holding a charger up to your mouth,64,,CS;;;;;;;;;
2021-8-28,2021-12-01,ryanmarksutherland,VIDEO,https://www.tiktok.com/@ryanmarksutherland/video/7001597800790117637?lang=en,TikTok,I thought you were a nun,54,,CS;;;;;;;;;
2021-8-28,2021-12-01,ryanmarksutherland,VIDEO,https://www.tiktok.com/@ryanmarksutherland/video/7001597800790117637?lang=en,TikTok,same oh my gosh is this an actual sponsor thing or a joke,10,,CS;;;;;;;;;
2021-8-28,2021-12-01,ryanmarksutherland,VIDEO,https://www.tiktok.com/@ryanmarksutherland/video/7001597800790117637?lang=en,TikTok,wait how am i so early,10,,CS;;;;;;;;;
2021-8-28,2021-12-01,ryanmarksutherland,VIDEO,https://www.tiktok.com/@ryanmarksutherland/video/7001597800790117637?lang=en,TikTok,GET 5 DOLLARS OFF your first month of Chegg Study Pack using the L1NK IN MY B1O!!!!📚🌙✨,36,,CS;;;;;;;;;
2021-8-28,2021-12-01,ryanmarksutherland,VIDEO,https://www.tiktok.com/@ryanmarksutherland/video/7001597800790117637?lang=en,TikTok,Early,25,,CS;;;;;;;;;
2021-8-28,2021-12-01,ryanmarksutherland,VIDEO,https://www.tiktok.com/@ryanmarksutherland/video/7001597800790117637?lang=en,TikTok,I thought this was a fake add-,22,,CS;;;;;;;;;
2021-8-28,2021-12-01,ryanmarksutherland,VIDEO,https://www.tiktok.com/@ryanmarksutherland/video/7001597800790117637?lang=en,TikTok,I can never tell if your joking or not HELP-,158,,CS;;;;;;;;;
"2021-10-11,2021-12-01,themccartys,VIDEO,https://www.tiktok.com/@themccartys/video/7017889678607142149?is_from_webapp=v1&lang=en,TikTok,""🥰💝🇺🇸 Hello, tell me, am I beautiful?🇺🇸🇬🇧🇨🇦😄😱🥰"",12,,CS";;;;;;;;;
2021-10-11,2021-12-01,themccartys,VIDEO,https://www.tiktok.com/@themccartys/video/7017889678607142149?is_from_webapp=v1&lang=en,TikTok,🥰💝🇺🇸 no 🇺🇸🇬🇧🇨🇦😄😱🥰,12,,CS;;;;;;;;;
2021-10-11,2021-12-01,themccartys,VIDEO,https://www.tiktok.com/@themccartys/video/7017889678607142149?is_from_webapp=v1&lang=en,TikTok,YI殺Where are you guys❤️,33,,CS;;;;;;;;;
2021-10-11,2021-12-01,thelawerangela,VIDEO,https://www.tiktok.com/@thelawyerangela/video/7018016230283988230?is_from_webapp=v1&lang=en,TikTok,chegg is terrible. they log your ip and send it to schools. so many kids have been honor coded cuz of chegg,17,,CS;;;;;;;;;
"2021-10-11,2021-12-01,thelawerangela,VIDEO,https://www.tiktok.com/@thelawyerangela/video/7018016230283988230?is_from_webapp=v1&lang=en,TikTok,""Yes so it’s for homework/study questions, not for cheating during remote exams. If u use it properly you’re all good 😎"",8,,CS";;;;;;;;;
"2021-9-26,2021-12-01,ryanmarksutherland,VIDEO,https://www.tiktok.com/@ryanmarksutherland/video/7012400629788265733?is_from_webapp=v1&lang=en,TikTok,""I love your videos so much, I cant believe I'm this early!!!!!"",8,,CS";;;;;;;;;
2021-9-26,2021-12-01,ryanmarksutherland,VIDEO,https://www.tiktok.com/@ryanmarksutherland/video/7012400629788265733?is_from_webapp=v1&lang=en,TikTok,MANS😍 STARE AT MI ACCOUNT 😳🙈🙈,82,,CS;;;;;;;;;
2021-9-26,2021-12-01,ryanmarksutherland,VIDEO,https://www.tiktok.com/@ryanmarksutherland/video/7012400629788265733?is_from_webapp=v1&lang=en,TikTok,earlyyyyy,12,,CS;;;;;;;;;
2021-9-2,2021-12-01,itssozer,VIDEO,https://www.tiktok.com/@itssozer/video/7003502008355278082?lang=en&is_copy_url=1&is_from_webapp=v1,TikTok,Ayyyy legend,50,,CS;;;;;;;;;
2021-9-2,2021-12-01,itssozer,VIDEO,https://www.tiktok.com/@itssozer/video/7003502008355278082?lang=en&is_copy_url=1&is_from_webapp=v1,TikTok,Are you serious,8,,CS;;;;;;;;;
2021-9-2,2021-12-01,itssozer,VIDEO,https://www.tiktok.com/@itssozer/video/7003502008355278082?lang=en&is_copy_url=1&is_from_webapp=v1,TikTok,Yes it's college but it's called university,9,,CS;;;;;;;;;
2021-9-2,2021-12-01,itssozer,VIDEO,https://www.tiktok.com/@itssozer/video/7003502008355278082?lang=en&is_copy_url=1&is_from_webapp=v1,TikTok,Your such an amazing person 😁,33,,CS;;;;;;;;;
2021-9-21,2021-12-01,thatrelatablestudent,VIDEO,https://www.tiktok.com/@thatrelatablestudent/video/7010543731241733382?lang=en&is_copy_url=1&is_from_webapp=v1,TikTok,Cappp it to get 2 days for a freaking reply,15,,CS;;;;;;;;;
2021-9-21,2021-12-01,thatrelatablestudent,VIDEO,https://www.tiktok.com/@thatrelatablestudent/video/7010543731241733382?lang=en&is_copy_url=1&is_from_webapp=v1,TikTok,soooo how much bread did you get with this collab,46,,CS;;;;;;;;;
2021-10-16,2021-12-01,lexistrechak,VIDEO,https://www.tiktok.com/foryou?is_from_webapp=v1&item_id=7019443237479861509&lang=en#/@lexistrechak/video/7019443237479861509,TikTok,4 people can’t be first for god sake,10,,CS;;;;;;;;;
2021-10-16,2021-12-01,lexistrechak,VIDEO,https://www.tiktok.com/foryou?is_from_webapp=v1&item_id=7019443237479861509&lang=en#/@lexistrechak/video/7019443237479861509,TikTok,So I’m the only one that cries on the first day of class Bc stress? Ok 🥲,14,,CS;;;;;;;;;
"2021-10-14,2021-12-15,JJ Medicine,VIDEO,https://www.youtube.com/watch?v=FwiaoKrdzx4,Youtube,""It’s mostly either fatty liver or thyroid/parathyroid, both of which can cause extreme tiredness."",0,,CS";;;;;;;;;
2021-10-14,2021-12-15,JJ Medicine,VIDEO,https://www.youtube.com/watch?v=FwiaoKrdzx4,Youtube,Important topic,0,,CS;;;;;;;;;
2021-10-14,2021-12-15,JJ Medicine,VIDEO,https://www.youtube.com/watch?v=FwiaoKrdzx4,Youtube,Have had this for four months I am hoping by month 5 or 6 it will be completely gone I have improved  a little. 21 year old male,0,,CS;;;;;;;;;
"2021-10-14,2021-12-15,JJ Medicine,VIDEO,https://www.youtube.com/watch?v=FwiaoKrdzx4,Youtube,""Most (or all) the people I know who have suffered from CFS also have fibromyalgia and have a history of prolonged trauma and stress. THAT is the underlying factor and the link. Adrenal fatigue is also related. See Dr Berg on naturally supporting the adrenals. That&#39";"s what has helped me. Eat healthy, adequate rest, build joy, destress as much as possible,.and support/nourish the adrenals ....prayer is also very helpful."",0,""@La Gatita Yes, like hell yes. 🥺"",CS";;;;;;;;
"2021-10-14,2021-12-15,JJ Medicine,VIDEO,https://www.youtube.com/watch?v=FwiaoKrdzx4,Youtube,""Most (or all) the people I know who have suffered from CFS also have fibromyalgia and have a history of prolonged trauma and stress. THAT is the underlying factor and the link. Adrenal fatigue is also related. See Dr Berg on naturally supporting the adrenals. That&#39";"s what has helped me. Eat healthy, adequate rest, build joy, destress as much as possible,.and support/nourish the adrenals ....prayer is also very helpful."",0,""@La Gatita in my experience, yes"",CS";;;;;;;;
2021-10-14,2021-12-15,JJ Medicine,VIDEO,https://www.youtube.com/watch?v=FwiaoKrdzx4,Youtube,I&#39;ve heard this often goes with anciety/ depression. I&#39;ve had that and I think having mono made them all worse.,0,I too had mono...ever since high Epstein bar loads.  And bad cfs. ....keep an eye on your Epstein bar. It&#39;s linked to serious bad disease.....get panels run when you do blood work. I have been sick w cfs for three years. Now I have an MRI for MS. Which is linked to Epstein bar. Just keep eye on these. I&#39;ve been trying to get help for three years. Just started to figure out what a monster EBV is. Mold is linked to chronic fatigue. And ebv. Check your house n work spaces. Wishing you good health. Happy Holidays.,CS;;;;;
2021-10-14,2021-12-15,JJ Medicine,VIDEO,https://www.youtube.com/watch?v=FwiaoKrdzx4,Youtube,Thanks<br>Very informative 👍,0,,CS;;;;;;;;;
"2021-10-14,2021-12-15,JJ Medicine,VIDEO,https://www.youtube.com/watch?v=FwiaoKrdzx4,Youtube,""Most (or all) the people I know who have suffered from CFS also have fibromyalgia and have a history of prolonged trauma and stress. THAT is the underlying factor and the link. Adrenal fatigue is also related. See Dr Berg on naturally supporting the adrenals. That&#39";"s what has helped me. Eat healthy, adequate rest, build joy, destress as much as possible,.and support/nourish the adrenals ....prayer is also very helpful."",0,@Tom Saywer I can be gone for months and then yo into full panic mode.,CS";;;;;;;;
2021-10-14,2021-12-15,JJ Medicine,VIDEO,https://www.youtube.com/watch?v=FwiaoKrdzx4,Youtube,Not me self diagnosing.. 😬,0,,CS;;;;;;;;;
2021-10-14,2021-12-15,JJ Medicine,VIDEO,https://www.youtube.com/watch?v=FwiaoKrdzx4,Youtube,I didn&#39;t even know this existed.<br>Thank you.,0,,CS;;;;;;;;
2021-10-14,2021-12-15,JJ Medicine,VIDEO,https://www.youtube.com/watch?v=FwiaoKrdzx4,Youtube,Bakeing soda and water with Lemons along with your minerals and vitamins and don’t listen to this net wet because he sure does have all the symptoms down to a T but he has no idea how to heal the body this is not healthcare this is ignorant death care,0,,CS;;;;;;;;;
"2021-10-14,2021-12-15,JJ Medicine,VIDEO,https://www.youtube.com/watch?v=FwiaoKrdzx4,Youtube,""I was diagnosed with Fibro/CFS in 2005, then found Dr. Jacob Teitlebaum, read his books then made an appt. at one of his clinics. I was pleased with the extensive testing that was done there and the answers I desperately needed to understand why I felt this way. This is a great video Thanks For Sharing!"",0,,CS";;;;;;;;;
2021-10-14,2021-12-15,JJ Medicine,VIDEO,https://www.youtube.com/watch?v=FwiaoKrdzx4,Youtube,Goo😀ood,0,,CS;;;;;;;;;
"2021-10-14,2021-12-15,JJ Medicine,VIDEO,https://www.youtube.com/watch?v=FwiaoKrdzx4,Youtube,""Most (or all) the people I know who have suffered from CFS also have fibromyalgia and have a history of prolonged trauma and stress. THAT is the underlying factor and the link. Adrenal fatigue is also related. See Dr Berg on naturally supporting the adrenals. That&#39";"s what has helped me. Eat healthy, adequate rest, build joy, destress as much as possible,.and support/nourish the adrenals ....prayer is also very helpful."",0,I had mono. Cleared now I have high EBV loads that have caused chronic fatigue for years. My daughter is doing this too. I got mono caring for her when she had mono. I got it as an 40 ye old....she was 10.,CS";;;;;;;;
2021-10-14,2021-12-15,JJ Medicine,VIDEO,https://www.youtube.com/watch?v=FwiaoKrdzx4,Youtube,lyme disease maybe...,0,,CS;;;;;;;;;
2021-10-14,2021-12-15,JJ Medicine,VIDEO,https://www.youtube.com/watch?v=FwiaoKrdzx4,Youtube,Falling asleep whilst watching this....zzzzzzzzx,0,Coffee 😁😁,CS;;;;;;;;;
"2021-10-14,2021-12-15,JJ Medicine,VIDEO,https://www.youtube.com/watch?v=FwiaoKrdzx4,Youtube,""Been sick pretty much all year, fibro runs in the family was diagnosed with it 2 years ago. Sleep 12-15 hours a day and am still tired, tried other ways of sleep as well. Lymph nodes always swollen, stomach always in pain and i work. I go to therapy, i take the meds, i do as told. Nothings changed. Starting to think it wont change been so tired for nearly 7 years now, nothing i try works."",0,,CS";;;;;;;;;
"2021-10-14,2021-12-15,JJ Medicine,VIDEO,https://www.youtube.com/watch?v=FwiaoKrdzx4,Youtube,""What is interesting in all of these videos is the total lack of recognition of the role of detrimental drug side effects  (ie. GI tract and microbiome damage) or nutritional deficiencies that result from a diet of ultra-processed, high sugar, high omega-6 diet, along with dairy and gluten, common issues related to this and many topics like gastric disorders."",0,,CS";;;;;;;;;
2021-10-14,2021-12-15,JJ Medicine,VIDEO,https://www.youtube.com/watch?v=FwiaoKrdzx4,Youtube,Excellent as always,0,,CS;;;;;;;;;
2021-10-14,2021-12-15,JJ Medicine,VIDEO,https://www.youtube.com/watch?v=FwiaoKrdzx4,Youtube,For somebody who is so educated is so ignorant because it can be cured with minerals and vitamins vitamin D three magnesium magnesium mulch chronic fatigue is more likely link to anemia. This is a case of Somebody who went to school and got the books and read them and tested on them but has absolutely no knowledge on the matter of the issue on hand and has no idea how to heal the body this is a prescription writer this is that care not healthcare,0,,CS;;;;;;;;;
2021-10-14,2021-12-15,JJ Medicine,VIDEO,https://www.youtube.com/watch?v=FwiaoKrdzx4,Youtube,Falling asleep whilst watching this....zzzzzzzzx,0,While?,CS;;;;;;;;;
2021-10-14,2021-12-15,JJ Medicine,VIDEO,https://www.youtube.com/watch?v=FwiaoKrdzx4,Youtube,Please molecular bio b krwa do 🙏🏻,0,,CS;;;;;;;;;
2021-10-14,2021-12-15,JJ Medicine,VIDEO,https://www.youtube.com/watch?v=FwiaoKrdzx4,Youtube,Epstein bar causing my CFS. It&#39;s a monster. Wishing all who see this healing. Happy Holidays.,0,,CS;;;;;;;;
"2021-10-14,2021-12-15,JJ Medicine,VIDEO,https://www.youtube.com/watch?v=FwiaoKrdzx4,Youtube,""Most (or all) the people I know who have suffered from CFS also have fibromyalgia and have a history of prolonged trauma and stress. THAT is the underlying factor and the link. Adrenal fatigue is also related. See Dr Berg on naturally supporting the adrenals. That&#39";"s what has helped me. Eat healthy, adequate rest, build joy, destress as much as possible,.and support/nourish the adrenals ....prayer is also very helpful."",0,I&#39";ve never had any trauma and not much stress what I would class as normal level with school exams etc and I have ME there&#39;s other reasons not just trauma 🤷🏻‍♀️,CS;;;;;;
"2021-10-14,2021-12-15,JJ Medicine,VIDEO,https://www.youtube.com/watch?v=FwiaoKrdzx4,Youtube,""I hope you all found this lesson helpful and informative! Thank you to this lesson&#39";"s sponsor, Chegg. Check out the link in the description to receive $5 off your first month of the Chegg Study Pack."",0,,CS";;;;;;;;
2021-10-14,2021-12-15,JJ Medicine,VIDEO,https://www.youtube.com/watch?v=FwiaoKrdzx4,Youtube,Thank you as always. You are the most helpful,0,,CS;;;;;;;;;
2021-11-4,2021-12-15,JJ Medicine,VIDEO,https://www.youtube.com/watch?v=PTN4omnwOyw,Youtube,Dr Ogbomon on YouTube has finally cure me from Herpes virus permanently with his herbal medications,0,,CS;;;;;;;;;
2021-11-4,2021-12-15,JJ Medicine,VIDEO,https://www.youtube.com/watch?v=PTN4omnwOyw,Youtube,Hey great information,0,,CS;;;;;;;;;
2021-11-4,2021-12-15,JJ Medicine,VIDEO,https://www.youtube.com/watch?v=PTN4omnwOyw,Youtube,ENABLE SUBTITLES PLEASEEEEEEEEEEEEEEEEEEEEEE...........,0,,CS;;;;;;;;;
2021-11-4,2021-12-15,JJ Medicine,VIDEO,https://www.youtube.com/watch?v=PTN4omnwOyw,Youtube,Thanks,0,,CS;;;;;;;;;
2021-11-4,2021-12-15,JJ Medicine,VIDEO,https://www.youtube.com/watch?v=PTN4omnwOyw,Youtube,👍,0,,CS;;;;;;;;;
"2021-11-22,2021-12-15,ninjanerdscience,VIDEO,https://www.youtube.com/watch?v=UJw2WUtHLIk,Youtube,""Excellent video ! Like, comment and share. 💪 + Carnivore diet (keto), wim hof breathing (suppression IL6, TNF-a...), cold Water, mental health... sooooo powerfull addition🙏"",0,Have you had your Microbiome tested after long term Carnivore diet? Would be fascinated to see where it sits and what bacteria its driving to extinction?,CS";;;;;;;;;
2021-11-22,2021-12-15,ninjanerdscience,VIDEO,https://www.youtube.com/watch?v=UJw2WUtHLIk,Youtube,I hit the like before watching the video 😂,0,,CS;;;;;;;;;
2021-11-22,2021-12-15,ninjanerdscience,VIDEO,https://www.youtube.com/watch?v=UJw2WUtHLIk,Youtube,The Greatest,0,,CS;;;;;;;;;
2021-11-22,2021-12-15,ninjanerdscience,VIDEO,https://www.youtube.com/watch?v=UJw2WUtHLIk,Youtube,Perfect perfect perfect perfect perfect,0,,CS;;;;;;;;;
"2021-11-22,2021-12-15,ninjanerdscience,VIDEO,https://www.youtube.com/watch?v=UJw2WUtHLIk,Youtube,""Excellent teaching, Sir."",0,,CS";;;;;;;;;
2021-11-22,2021-12-15,ninjanerdscience,VIDEO,https://www.youtube.com/watch?v=UJw2WUtHLIk,Youtube,I appreciate my lovely husband for directing me to this holistic herbalist called Dr alaho olu i met on YouTube. He cured my herpes simplex virus…,0,,CS;;;;;;;;;
2021-11-22,2021-12-15,ninjanerdscience,VIDEO,https://www.youtube.com/watch?v=UJw2WUtHLIk,Youtube,Hi Sir. Your videos are amazing. I really appreciate the efforts you put in to make such great vidoes. Your videos really helped me during my entrance preparation for post-graduation. Thank you very much. I am planning to take Dermatology sir. I need your guidance. Is there any way I can contact you?,0,,CS;;;;;;;;;
2021-11-22,2021-12-15,ninjanerdscience,VIDEO,https://www.youtube.com/watch?v=UJw2WUtHLIk,Youtube,Great,0,,CS;;;;;;;;;
2021-11-22,2021-12-15,ninjanerdscience,VIDEO,https://www.youtube.com/watch?v=UJw2WUtHLIk,Youtube,A Medical student AND a Crohn’s patient here... thank you from both perspectives :)<br>Didn’t watch yet but I’m sure it’ll be as amazing as always !,0,,CS;;;;;;;;;
2021-11-22,2021-12-15,ninjanerdscience,VIDEO,https://www.youtube.com/watch?v=UJw2WUtHLIk,Youtube,Upload lectures on HIV and AIDS,0,,CS;;;;;;;;;
2021-11-22,2021-12-15,ninjanerdscience,VIDEO,https://www.youtube.com/watch?v=UJw2WUtHLIk,Youtube,Please I need meiosis!!!,0,,CS;;;;;;;;;
"2021-11-22,2021-12-15,ninjanerdscience,VIDEO,https://www.youtube.com/watch?v=UJw2WUtHLIk,Youtube,""Thank you so so much,  <br>Sir, Pleasssssse&#39";" ulcerative colitis"",0,,CS";;;;;;;;
2021-11-22,2021-12-15,ninjanerdscience,VIDEO,https://www.youtube.com/watch?v=UJw2WUtHLIk,Youtube,Great video as always guys ❤️,0,,CS;;;;;;;;;
2021-11-22,2021-12-15,ninjanerdscience,VIDEO,https://www.youtube.com/watch?v=UJw2WUtHLIk,Youtube,I love you,0,,CS;;;;;;;;;
"2021-11-22,2021-12-15,ninjanerdscience,VIDEO,https://www.youtube.com/watch?v=UJw2WUtHLIk,Youtube,""I have had Crohn&#39";s and UC for over 20 years.  I developed adenocarcinoma and had the entire large bowel and 2 ft of small bowel. Left with an ileostomy.  Crohn&#39;s is definitely a genetic predisposition in my family.  My interest is in the epigenetic switches that are involved in this situation.  My disease sparked my interest in nursing.  Many in my family were veterans during the Vietnam Era, and I&#39;"m convinced that agent orange caused gene mutation."",0,@Jarrod Hall  it’s not my job to do his homework.,CS";;;;;;
2021-11-22,2021-12-15,ninjanerdscience,VIDEO,https://www.youtube.com/watch?v=UJw2WUtHLIk,Youtube,The heavy or frequent use of antibiotics could be a part of the problem.,0,,CS;;;;;;;;;
"2021-11-22,2021-12-15,ninjanerdscience,VIDEO,https://www.youtube.com/watch?v=UJw2WUtHLIk,Youtube,""This is brilliant material, great visuals and perfectly timed to the world of taking control of your illness through self education rather than outsourcing to specialist&#39";"s that use outdated playbooks!"",0,,CS";;;;;;;;
2021-11-22,2021-12-15,ninjanerdscience,VIDEO,https://www.youtube.com/watch?v=UJw2WUtHLIk,Youtube,I like your cool videos,0,,CS;;;;;;;;;
2021-11-22,2021-12-15,ninjanerdscience,VIDEO,https://www.youtube.com/watch?v=UJw2WUtHLIk,Youtube,pls explain ulcerative colitis also,0,,CS;;;;;;;;;
2021-11-22,2021-12-15,ninjanerdscience,VIDEO,https://www.youtube.com/watch?v=UJw2WUtHLIk,Youtube,Getting rid of herpes virus was hard for me I had HSV for years and then I came across  Dr Idakwo on YouTube who used his herbs to cure me and now I’m cured,0,,CS;;;;;;;;;
2021-11-22,2021-12-15,ninjanerdscience,VIDEO,https://www.youtube.com/watch?v=UJw2WUtHLIk,Youtube,You are amazing man,0,,CS;;;;;;;;;
2021-11-22,2021-12-15,ninjanerdscience,VIDEO,https://www.youtube.com/watch?v=UJw2WUtHLIk,Youtube,lets go brother ! youre perfect ! plz give more free videos !,0,,CS;;;;;;;;;
2021-11-22,2021-12-15,ninjanerdscience,VIDEO,https://www.youtube.com/watch?v=UJw2WUtHLIk,Youtube,Ninja nerd I&#39;m so happy that you choose that subject today. First comment!!! For the first time. LoL. Please next talk about ulcerative colitis,0,Ulcerative Colitis is next to be released! Hoping to get this done as soon as we can! 😀,CS;;;;;;;;
"2021-11-22,2021-12-15,ninjanerdscience,VIDEO,https://www.youtube.com/watch?v=UJw2WUtHLIk,Youtube,""I have had Crohn&#39";s and UC for over 20 years.  I developed adenocarcinoma and had the entire large bowel and 2 ft of small bowel. Left with an ileostomy.  Crohn&#39;s is definitely a genetic predisposition in my family.  My interest is in the epigenetic switches that are involved in this situation.  My disease sparked my interest in nursing.  Many in my family were veterans during the Vietnam Era, and I&#39;"m convinced that agent orange caused gene mutation."",0,@Lean GroundBeef your the one asking where the evidence is that herbs work and there&#39";s plenty if you know how to use Google.,CS;;;;;
"2021-11-22,2021-12-15,ninjanerdscience,VIDEO,https://www.youtube.com/watch?v=UJw2WUtHLIk,Youtube,""You’ve forgotten to include another treatment pathway being triple antibiotic therapy which includes Claritjromycin, Rifabutin and Clofazimine plus sometimes Metronidazole. There is 20 year body of research showing this combination can induce remission in up to 80% of patients by targeting the gut bacteria believed to be implicated in the inflammatory process. This should at least be tried as a last resort before surgery."",0,,CS";;;;;;;;;
2021-11-22,2021-12-15,ninjanerdscience,VIDEO,https://www.youtube.com/watch?v=UJw2WUtHLIk,Youtube,You are amazing man. Thanks for this topic..<br>We need Ulcerative colitis also....,0,,CS;;;;;;;;;
"2021-11-22,2021-12-15,ninjanerdscience,VIDEO,https://www.youtube.com/watch?v=UJw2WUtHLIk,Youtube,""Zach, please make some lectures about histology. Thanks beforehand!"",0,,CS";;;;;;;;;
"2021-11-22,2021-12-15,ninjanerdscience,VIDEO,https://www.youtube.com/watch?v=UJw2WUtHLIk,Youtube,""Dr osaba cure all kinds of diseases such as HIV, HERPES virus, CANCER, DIABETES, FIBROID , HPV, STD, you can reach out to Dr osaba on his YouTube channel ."",0,,CS";;;;;;;;;
"2021-11-22,2021-12-15,ninjanerdscience,VIDEO,https://www.youtube.com/watch?v=UJw2WUtHLIk,Youtube,""Just writing an essay about crohns and uc for my assignment, this is quite helpful for me to check I’ve put everything correctly. 👍"",0,,CS";;;;;;;;;
"2021-11-22,2021-12-15,ninjanerdscience,VIDEO,https://www.youtube.com/watch?v=UJw2WUtHLIk,Youtube,""Regarding the inflammatory processes at work, I&#39";m seeing a lot of overlap with those active in COVID, ad many other diseases.  What&#39;s the word on Vitamin D as an anti-inflammatory therapy for CD?  I know CD patients tend to have lower levels but, as usual, it&#39;"s hard to distinguish cause from effect.  In any event, it seems that substantial D3 supplementation would be: A: Likely harmless and B: Very possibly beneficial."",0,""That’s interesting. I’m a nurse on a GI ward and I’ve been noticing a bit of an upswing in numbers of young people with new or flares of Crohns. It may be co-relation, it maybe causation, it may be just me looking out for it."",CS";;;;;;
2021-11-22,2021-12-15,ninjanerdscience,VIDEO,https://www.youtube.com/watch?v=UJw2WUtHLIk,Youtube,Everywhere is a trace of immune system 😂😂😂.You are emazing zack👌👌👌,0,,CS;;;;;;;;;
"2021-11-22,2021-12-15,ninjanerdscience,VIDEO,https://www.youtube.com/watch?v=UJw2WUtHLIk,Youtube,""I have had Crohn&#39";s and UC for over 20 years.  I developed adenocarcinoma and had the entire large bowel and 2 ft of small bowel. Left with an ileostomy.  Crohn&#39;s is definitely a genetic predisposition in my family.  My interest is in the epigenetic switches that are involved in this situation.  My disease sparked my interest in nursing.  Many in my family were veterans during the Vietnam Era, and I&#39;"m convinced that agent orange caused gene mutation."",0,@Lean GroundBeef Just need to learn how to use google! There&#39";s is plenty of evidence that herbs/foods work!,CS;;;;;
